### ISSUE TITLE
[BUG] climc version-list  执行hang住

### ISSUE THREAD

**Issue by fangpsh** [yunionio/cloudpods#18321]
**问题描述/What happened**:
之前meta.yunion.cn 和tracker.yunion.cn 解析指向114.113.84.2 ，这个ip 无法连通，直接timeout，影响不大：
<img width="500" alt="image" src="https://github.com/yunionio/cloudpods/assets/1650540/2eac6582-a913-4e73-bbfb-84ce8e90fcf5">

现在域名改到47.57.69.87 阿里云香港ip 之后，climc version-list  执行hang住。

抓包发现hang住期间，持续和47.57 的ip 连接：
```
12:01:59.538658 IP 192.168.8.3.46072 > 47.57.69.87.443: Flags [.], ack 5993, win 501, options [nop,nop,TS val 1409420594 ecr 1934066256], length 0
12:01:59.557056 IP 47.57.69.87.443 > 192.168.8.3.46072: Flags [.], ack 550, win 486, options [nop,nop,TS val 1934071275 ecr 1409415534], length 0
12:02:04.652691 IP 192.168.8.3.46072 > 47.57.69.87.443: Flags [.], ack 5993, win 501, options [nop,nop,TS val 1409425708 ecr 1934071275], length 0
12:02:04.670773 IP 47.57.69.87.443 > 192.168.8.3.46072: Flags [.], ack 550, win 486, options [nop,nop,TS val 1934076389 ecr 1409415534], length 0
```

线程阻塞：
```
[pid 23500] epoll_pwait(4, [{EPOLLOUT, {u32=4272165088, u64=140398163136736}}], 128, 0, NULL, 140398128475304) = 1
[pid 23500] epoll_pwait(4, [{EPOLLOUT, {u32=4272165088, u64=140398163136736}}], 128, 748, NULL, 7672584695402970) = 1
[pid 23500] epoll_pwait(4, [{EPOLLOUT, {u32=4272165088, u64=140398163136736}}], 128, 0, NULL, 140398128475304) = 1
[pid 23500] epoll_pwait(4, [{EPOLLOUT, {u32=4272165088, u64=140398163136736}}], 128, 748, NULL, 7672584695402970) = 1
[pid 23500] epoll_pwait(4, [{EPOLLOUT, {u32=4272165088, u64=140398163136736}}], 128, 0, NULL, 140398128475304) = 1
[pid 23500] epoll_pwait(4, [{EPOLLOUT, {u32=4272165088, u64=140398163136736}}], 128, 748, NULL, 7672584695402970) = 1
[pid 23500] epoll_pwait(4, [{EPOLLOUT, {u32=4272165088, u64=140398163136736}}], 128, 0, NULL, 140398128475304) = 1
[pid 23500] epoll_pwait(4, [{EPOLLOUT, {u32=4272165088, u64=140398163136736}}], 128, ^C, NULL, 7672584695402970) = 1
```

感觉在等待网络io，猜测和这个域名修改行为强相关。

查看发现climc 版本是3.10.3，相对cloudpods 版本3.10.6 较低。但是目前没找到可以升级climc 的地方，升级cloudpods版本似乎不会直接升级climc？

**环境/Environment**:
cloudpods 版本：3.10.6 

climc 版本：
```
 climc -v
Yunion API client version:
 {
  "major": "0",
  "minor": "0",
  "gitVersion": "v3.10.3",
  "gitBranch": "release/3.10",
  "gitCommit": "53a83b59ff",
  "gitTreeState": "clean",
  "buildDate": "2023-06-30T06:24:28Z",
  "goVersion": "go1.18.3",
  "compiler": "gc",
  "platform": "linux/amd64"
}
```

**Comment by fangpsh** [comment]
hang住，长时间等待之后，输出：
```
+-----------------+---------------------------------------------------+
| ansible         | release/3.10(7d8b4cd9b523101015)                  |
| apimap          | release/3.10(7d8b4cd9b523101015)                  |
| cloudevent      | release/3.10(7d8b4cd9b523101015)                  |
| cloudid         | release/3.10(7d8b4cd9b523101015)                  |
                                           |
 |                | <head><title>504 Gateway Time-out</title></head>
                                           |
   |              | <center><h1>504 Gateway Time-out</h1></center>
                | | <hr><center>nginx/1.20.1</center>
                                          |
                                          |
| cloudmon        | release/3.10(7d8b4cd9b523101015)                  |
| cloudproxy      | release/3.10(7d8b4cd9b523101015)                  |
| compute_v2      | release/3.10(7d8b4cd9b523101015)                  |
| devtool         | release/3.10(7d8b4cd9b523101015)                  |
| etcd            | {"etcdserver":"3.4.6","etcdcluster":"3.4.0"}      |
| identity        | release/3.10(7d8b4cd9b523101015)                  |
| image           | release/3.10(7d8b4cd9b523101015)                  |
| influxdb        | 404 page not found                                |
| k8s             | heads/v3.10.6-20231010.4(e94e5fb923101015)        |
| log             | release/3.10(7d8b4cd9b523101015)                  |
| monitor         | release/3.10(7d8b4cd9b523101015)                  |
| notify          | release/3.10(7d8b4cd9b523101015)                  |
| scheduledtask   | release/3.10(7d8b4cd9b523101015)                  |
| scheduler       | release/3.10(7d8b4cd9b523101015)                  |
                                           |
 |                | <head><title>504 Gateway Time-out</title></head>
                                           |
   |              | <center><h1>504 Gateway Time-out</h1></center>
                | | <hr><center>nginx/1.20.1</center>
                                          |
                                          |
| vpcagent        | release/3.10(7d8b4cd9b523101015)                  |
| webconsole      | release/3.10(7d8b4cd9b523101015)                  |
| yunionconf      | release/3.10(7d8b4cd9b523101015)                  |
+-----------------+---------------------------------------------------+

```

**Comment by fangpsh** [comment]
修改域名指向之前：climc version-list 输出：
https://github.com/yunionio/cloudpods/issues/18298
```
| torrent-tracker | {"error":{"class":"ClientError","code":499,"details":"Get \"https://tracker.yunion.cn/version\": dial tcp 114.113.84.2:443: i/o timeout","request":{"headers":{"User-Agent":"yunioncloud-go/201708","X-Auth-Token":"*"},"method":"GET","url":"https://tracker.yunion |
|                 | .cn/version"}}}  
```
转为 504 超时。

**Comment by swordqiu** [comment]
@fangpsh 收到，我们处理一下

**Comment by swordqiu** [comment]
@fangpsh 已经处理，tracker和meta两个服务已经废弃，现在返回伪造的版本后。后续会移除这两个服务。

**Comment by fangpsh** [comment]
测试了下，确认已恢复。
